{
  "$schema": "https://memory-os.example/schemas/security/archive-safety-case-set.v1.schema.json",
  "caseSetId": "memory-os.security.archive-safety-cases.round9",
  "caseSetVersion": 1,
  "profileRef": "docs/fixtures/memory-os-security/archive-safety-profile.round9.valid.v1.json",
  "cases": [
    {"caseId":"valid-flat-zip","archiveType":"zip","compressedBytes":1048576,"expandedBytes":4194304,"singleEntryExpandedBytes":1048576,"entryCount":20,"compressionRatio":4,"nestedArchiveDepth":0,"pathKind":"safe","duplicateNormalizedPath":false,"caseFoldCollision":false,"entryType":"regular","encrypted":false,"multiVolume":false,"compressionMethodKnown":true,"centralDirectoryValid":true,"jsonDepth":8,"jsonDuplicateKeys":false,"csvMaxCellBytes":4096,"expectedDecision":"allow","expectedIssueCode":"SEC_AUTHORIZED"},
    {"caseId":"parent-traversal","archiveType":"zip","compressedBytes":100,"expandedBytes":200,"singleEntryExpandedBytes":200,"entryCount":1,"compressionRatio":2,"nestedArchiveDepth":0,"pathKind":"parent_traversal","duplicateNormalizedPath":false,"caseFoldCollision":false,"entryType":"regular","encrypted":false,"multiVolume":false,"compressionMethodKnown":true,"centralDirectoryValid":true,"jsonDepth":1,"jsonDuplicateKeys":false,"csvMaxCellBytes":1,"expectedDecision":"deny","expectedIssueCode":"SEC_ARCHIVE_PATH_TRAVERSAL"},
    {"caseId":"backslash-traversal","archiveType":"zip","compressedBytes":100,"expandedBytes":200,"singleEntryExpandedBytes":200,"entryCount":1,"compressionRatio":2,"nestedArchiveDepth":0,"pathKind":"backslash_traversal","duplicateNormalizedPath":false,"caseFoldCollision":false,"entryType":"regular","encrypted":false,"multiVolume":false,"compressionMethodKnown":true,"centralDirectoryValid":true,"jsonDepth":1,"jsonDuplicateKeys":false,"csvMaxCellBytes":1,"expectedDecision":"deny","expectedIssueCode":"SEC_ARCHIVE_PATH_TRAVERSAL"},
    {"caseId":"absolute-unix-path","archiveType":"zip","compressedBytes":100,"expandedBytes":200,"singleEntryExpandedBytes":200,"entryCount":1,"compressionRatio":2,"nestedArchiveDepth":0,"pathKind":"absolute_unix","duplicateNormalizedPath":false,"caseFoldCollision":false,"entryType":"regular","encrypted":false,"multiVolume":false,"compressionMethodKnown":true,"centralDirectoryValid":true,"jsonDepth":1,"jsonDuplicateKeys":false,"csvMaxCellBytes":1,"expectedDecision":"deny","expectedIssueCode":"SEC_ARCHIVE_ABSOLUTE_PATH"},
    {"caseId":"windows-drive-path","archiveType":"zip","compressedBytes":100,"expandedBytes":200,"singleEntryExpandedBytes":200,"entryCount":1,"compressionRatio":2,"nestedArchiveDepth":0,"pathKind":"windows_drive","duplicateNormalizedPath":false,"caseFoldCollision":false,"entryType":"regular","encrypted":false,"multiVolume":false,"compressionMethodKnown":true,"centralDirectoryValid":true,"jsonDepth":1,"jsonDuplicateKeys":false,"csvMaxCellBytes":1,"expectedDecision":"deny","expectedIssueCode":"SEC_ARCHIVE_WINDOWS_DRIVE_PATH"},
    {"caseId":"nul-filename","archiveType":"zip","compressedBytes":100,"expandedBytes":200,"singleEntryExpandedBytes":200,"entryCount":1,"compressionRatio":2,"nestedArchiveDepth":0,"pathKind":"nul","duplicateNormalizedPath":false,"caseFoldCollision":false,"entryType":"regular","encrypted":false,"multiVolume":false,"compressionMethodKnown":true,"centralDirectoryValid":true,"jsonDepth":1,"jsonDuplicateKeys":false,"csvMaxCellBytes":1,"expectedDecision":"deny","expectedIssueCode":"SEC_ARCHIVE_FILENAME_INVALID"},
    {"caseId":"path-too-long","archiveType":"zip","compressedBytes":100,"expandedBytes":200,"singleEntryExpandedBytes":200,"entryCount":1,"compressionRatio":2,"nestedArchiveDepth":0,"pathKind":"too_long","duplicateNormalizedPath":false,"caseFoldCollision":false,"entryType":"regular","encrypted":false,"multiVolume":false,"compressionMethodKnown":true,"centralDirectoryValid":true,"jsonDepth":1,"jsonDuplicateKeys":false,"csvMaxCellBytes":1,"expectedDecision":"deny","expectedIssueCode":"SEC_ARCHIVE_FILENAME_INVALID"},
    {"caseId":"symlink-entry","archiveType":"zip","compressedBytes":100,"expandedBytes":200,"singleEntryExpandedBytes":200,"entryCount":1,"compressionRatio":2,"nestedArchiveDepth":0,"pathKind":"safe","duplicateNormalizedPath":false,"caseFoldCollision":false,"entryType":"symlink","encrypted":false,"multiVolume":false,"compressionMethodKnown":true,"centralDirectoryValid":true,"jsonDepth":1,"jsonDuplicateKeys":false,"csvMaxCellBytes":1,"expectedDecision":"deny","expectedIssueCode":"SEC_ARCHIVE_LINK_FORBIDDEN"},
    {"caseId":"hardlink-entry","archiveType":"zip","compressedBytes":100,"expandedBytes":200,"singleEntryExpandedBytes":200,"entryCount":1,"compressionRatio":2,"nestedArchiveDepth":0,"pathKind":"safe","duplicateNormalizedPath":false,"caseFoldCollision":false,"entryType":"hardlink","encrypted":false,"multiVolume":false,"compressionMethodKnown":true,"centralDirectoryValid":true,"jsonDepth":1,"jsonDuplicateKeys":false,"csvMaxCellBytes":1,"expectedDecision":"deny","expectedIssueCode":"SEC_ARCHIVE_LINK_FORBIDDEN"},
    {"caseId":"device-entry","archiveType":"zip","compressedBytes":100,"expandedBytes":200,"singleEntryExpandedBytes":200,"entryCount":1,"compressionRatio":2,"nestedArchiveDepth":0,"pathKind":"safe","duplicateNormalizedPath":false,"caseFoldCollision":false,"entryType":"device","encrypted":false,"multiVolume":false,"compressionMethodKnown":true,"centralDirectoryValid":true,"jsonDepth":1,"jsonDuplicateKeys":false,"csvMaxCellBytes":1,"expectedDecision":"deny","expectedIssueCode":"SEC_ARCHIVE_SPECIAL_FILE_FORBIDDEN"},
    {"caseId":"compressed-size-limit","archiveType":"zip","compressedBytes":268435457,"expandedBytes":268435457,"singleEntryExpandedBytes":1,"entryCount":1,"compressionRatio":1,"nestedArchiveDepth":0,"pathKind":"safe","duplicateNormalizedPath":false,"caseFoldCollision":false,"entryType":"regular","encrypted":false,"multiVolume":false,"compressionMethodKnown":true,"centralDirectoryValid":true,"jsonDepth":1,"jsonDuplicateKeys":false,"csvMaxCellBytes":1,"expectedDecision":"deny","expectedIssueCode":"SEC_ARCHIVE_COMPRESSED_SIZE_LIMIT"},
    {"caseId":"expanded-size-limit","archiveType":"zip","compressedBytes":1048576,"expandedBytes":1073741825,"singleEntryExpandedBytes":1048576,"entryCount":100,"compressionRatio":50,"nestedArchiveDepth":0,"pathKind":"safe","duplicateNormalizedPath":false,"caseFoldCollision":false,"entryType":"regular","encrypted":false,"multiVolume":false,"compressionMethodKnown":true,"centralDirectoryValid":true,"jsonDepth":1,"jsonDuplicateKeys":false,"csvMaxCellBytes":1,"expectedDecision":"deny","expectedIssueCode":"SEC_ARCHIVE_EXPANDED_SIZE_LIMIT"},
    {"caseId":"single-entry-size-limit","archiveType":"zip","compressedBytes":1048576,"expandedBytes":134217729,"singleEntryExpandedBytes":134217729,"entryCount":1,"compressionRatio":50,"nestedArchiveDepth":0,"pathKind":"safe","duplicateNormalizedPath":false,"caseFoldCollision":false,"entryType":"regular","encrypted":false,"multiVolume":false,"compressionMethodKnown":true,"centralDirectoryValid":true,"jsonDepth":1,"jsonDuplicateKeys":false,"csvMaxCellBytes":1,"expectedDecision":"deny","expectedIssueCode":"SEC_ARCHIVE_ENTRY_SIZE_LIMIT"},
    {"caseId":"entry-count-limit","archiveType":"zip","compressedBytes":1048576,"expandedBytes":10485760,"singleEntryExpandedBytes":1024,"entryCount":10001,"compressionRatio":10,"nestedArchiveDepth":0,"pathKind":"safe","duplicateNormalizedPath":false,"caseFoldCollision":false,"entryType":"regular","encrypted":false,"multiVolume":false,"compressionMethodKnown":true,"centralDirectoryValid":true,"jsonDepth":1,"jsonDuplicateKeys":false,"csvMaxCellBytes":1,"expectedDecision":"deny","expectedIssueCode":"SEC_ARCHIVE_ENTRY_COUNT_LIMIT"},
    {"caseId":"compression-ratio-limit","archiveType":"zip","compressedBytes":1024,"expandedBytes":103424,"singleEntryExpandedBytes":103424,"entryCount":1,"compressionRatio":101,"nestedArchiveDepth":0,"pathKind":"safe","duplicateNormalizedPath":false,"caseFoldCollision":false,"entryType":"regular","encrypted":false,"multiVolume":false,"compressionMethodKnown":true,"centralDirectoryValid":true,"jsonDepth":1,"jsonDuplicateKeys":false,"csvMaxCellBytes":1,"expectedDecision":"deny","expectedIssueCode":"SEC_ARCHIVE_COMPRESSION_RATIO_LIMIT"},
    {"caseId":"nested-archive-limit","archiveType":"zip","compressedBytes":1024,"expandedBytes":4096,"singleEntryExpandedBytes":4096,"entryCount":1,"compressionRatio":4,"nestedArchiveDepth":2,"pathKind":"safe","duplicateNormalizedPath":false,"caseFoldCollision":false,"entryType":"regular","encrypted":false,"multiVolume":false,"compressionMethodKnown":true,"centralDirectoryValid":true,"jsonDepth":1,"jsonDuplicateKeys":false,"csvMaxCellBytes":1,"expectedDecision":"deny","expectedIssueCode":"SEC_ARCHIVE_NESTING_LIMIT"},
    {"caseId":"duplicate-normalized-path","archiveType":"zip","compressedBytes":1024,"expandedBytes":4096,"singleEntryExpandedBytes":2048,"entryCount":2,"compressionRatio":4,"nestedArchiveDepth":0,"pathKind":"safe","duplicateNormalizedPath":true,"caseFoldCollision":false,"entryType":"regular","encrypted":false,"multiVolume":false,"compressionMethodKnown":true,"centralDirectoryValid":true,"jsonDepth":1,"jsonDuplicateKeys":false,"csvMaxCellBytes":1,"expectedDecision":"deny","expectedIssueCode":"SEC_ARCHIVE_DUPLICATE_PATH"},
    {"caseId":"case-fold-collision","archiveType":"zip","compressedBytes":1024,"expandedBytes":4096,"singleEntryExpandedBytes":2048,"entryCount":2,"compressionRatio":4,"nestedArchiveDepth":0,"pathKind":"safe","duplicateNormalizedPath":false,"caseFoldCollision":true,"entryType":"regular","encrypted":false,"multiVolume":false,"compressionMethodKnown":true,"centralDirectoryValid":true,"jsonDepth":1,"jsonDuplicateKeys":false,"csvMaxCellBytes":1,"expectedDecision":"deny","expectedIssueCode":"SEC_ARCHIVE_CASE_COLLISION"},